{
  "version": 1,
  "scannerVersion": "1.1.0",
  "generatedAt": "2026-06-08T13:39:06.449Z",
  "root": "/Users/vcsm/Desktop/VCSM",
  "scanDurationMs": 6492,
  "confidence": "HIGH",
  "rpcCount": 73,
  "data": {
    "version": 1,
    "generatedAt": "2026-06-08T13:39:02.623Z",
    "rpcs": [
      {
        "rpc": "block_actor",
        "schema": "moderation",
        "file": "apps/VCSM/src/features/block/dal/block.write.dal.js",
        "appId": "VCSM",
        "root": "apps/VCSM",
        "feature": "block",
        "engine": null,
        "caller": "blockActor",
        "confidence": "HIGH",
        "evidence": [
          "rpc() extracted from AST"
        ]
      },
      {
        "rpc": "block_actor",
        "schema": "moderation",
        "file": "apps/VCSM/src/features/settings/privacy/dal/blocks.dal.js",
        "appId": "VCSM",
        "root": "apps/VCSM",
        "feature": "settings",
        "engine": null,
        "caller": "dalInsertBlock",
        "confidence": "HIGH",
        "evidence": [
          "rpc() extracted from AST"
        ]
      },
      {
        "rpc": "can_view_actor_signal",
        "schema": "vc",
        "file": "apps/VCSM/src/features/social/privacy/dal/actorSignalVisibility.dal.js",
        "appId": "VCSM",
        "root": "apps/VCSM",
        "feature": "social",
        "engine": null,
        "caller": "dalCanViewActorSignal",
        "confidence": "HIGH",
        "evidence": [
          "rpc() extracted from AST"
        ]
      },
      {
        "rpc": "count_unread_batch",
        "schema": "notification",
        "file": "apps/VCSM/src/features/notifications/runtime/notificationRuntime.dal.js",
        "appId": "VCSM",
        "root": "apps/VCSM",
        "feature": "notifications",
        "engine": null,
        "caller": "countUnreadBatchDAL",
        "confidence": "HIGH",
        "evidence": [
          "rpc() extracted from AST"
        ]
      },
      {
        "rpc": "count_unread_for_actor",
        "schema": "notification",
        "file": "apps/VCSM/src/features/notifications/runtime/notificationRuntime.dal.js",
        "appId": "VCSM",
        "root": "apps/VCSM",
        "feature": "notifications",
        "engine": null,
        "caller": "countUnreadForActorDAL",
        "confidence": "HIGH",
        "evidence": [
          "rpc() extracted from AST"
        ]
      },
      {
        "rpc": "count_vport_subscribers",
        "schema": "vc",
        "file": "apps/VCSM/src/features/profiles/kinds/vport/dal/subscribersCount.dal.js",
        "appId": "VCSM",
        "root": "apps/VCSM",
        "feature": "profiles",
        "engine": null,
        "caller": "dalCountVportSubscribers",
        "confidence": "HIGH",
        "evidence": [
          "rpc() extracted from AST"
        ]
      },
      {
        "rpc": "create_actor_for_user",
        "schema": "vc",
        "file": "apps/VCSM/src/dev/diagnostics/helpers/ensureActorContext.js",
        "appId": "VCSM",
        "root": "apps/VCSM",
        "feature": null,
        "engine": null,
        "caller": "createUserActorViaLegacyRpc",
        "confidence": "HIGH",
        "evidence": [
          "rpc() extracted from AST"
        ]
      },
      {
        "rpc": "create_actor_for_user",
        "schema": "vc",
        "file": "apps/VCSM/src/features/auth/onboarding/dal/actorCreate.dal.js",
        "appId": "VCSM",
        "root": "apps/VCSM",
        "feature": "auth",
        "engine": null,
        "caller": "dalCreateUserActor",
        "confidence": "HIGH",
        "evidence": [
          "rpc() extracted from AST"
        ]
      },
      {
        "rpc": "create_actor_for_user",
        "schema": "vc",
        "file": "apps/VCSM/src/scripts/load/simulateAuthenticatedActors.mjs",
        "appId": "VCSM",
        "root": "apps/VCSM",
        "feature": null,
        "engine": null,
        "caller": "resolveOrCreateActor",
        "confidence": "HIGH",
        "evidence": [
          "rpc() extracted from AST"
        ]
      },
      {
        "rpc": "create_event",
        "schema": "notification",
        "file": "apps/VCSM/src/features/notifications/runtime/notificationRuntime.dal.js",
        "appId": "VCSM",
        "root": "apps/VCSM",
        "feature": "notifications",
        "engine": null,
        "caller": "insertNotificationEventDAL",
        "confidence": "HIGH",
        "evidence": [
          "rpc() extracted from AST"
        ]
      },
      {
        "rpc": "create_event",
        "schema": "notification",
        "file": "engines/notifications/src/dal/events.write.dal.js",
        "appId": null,
        "root": "engines/notifications",
        "feature": null,
        "engine": "notifications",
        "caller": "dalInsertEvent",
        "confidence": "HIGH",
        "evidence": [
          "rpc() extracted from AST"
        ]
      },
      {
        "rpc": "create_tenant_bootstrap",
        "schema": "learning",
        "file": "apps/wentrex/supabase/functions/create-tenant/index.ts",
        "appId": "wentrex",
        "root": "apps/wentrex",
        "feature": null,
        "engine": null,
        "caller": null,
        "confidence": "HIGH",
        "evidence": [
          "rpc() extracted from AST"
        ]
      },
      {
        "rpc": "create_vport",
        "schema": "vport",
        "file": "apps/VCSM/src/dev/diagnostics/groups/vports.group.js",
        "appId": "VCSM",
        "root": "apps/VCSM",
        "feature": null,
        "engine": null,
        "caller": "runVportsGroup",
        "confidence": "HIGH",
        "evidence": [
          "rpc() extracted from AST"
        ]
      },
      {
        "rpc": "create_vport",
        "schema": "vport",
        "file": "apps/VCSM/src/dev/diagnostics/helpers/ensureVportSeed.js",
        "appId": "VCSM",
        "root": "apps/VCSM",
        "feature": null,
        "engine": null,
        "caller": "createVportViaRpc",
        "confidence": "HIGH",
        "evidence": [
          "rpc() extracted from AST"
        ]
      },
      {
        "rpc": "create_vport",
        "schema": null,
        "file": "apps/VCSM/src/features/vport/dal/vport.core.dal.js",
        "appId": "VCSM",
        "root": "apps/VCSM",
        "feature": "vport",
        "engine": null,
        "caller": "createVport",
        "confidence": "HIGH",
        "evidence": [
          "rpc() extracted from AST"
        ]
      },
      {
        "rpc": "ensure_org_member_account",
        "schema": "learning",
        "file": "apps/wentrex/supabase/functions/create-org-member/index.ts",
        "appId": "wentrex",
        "root": "apps/wentrex",
        "feature": null,
        "engine": null,
        "caller": null,
        "confidence": "HIGH",
        "evidence": [
          "rpc() extracted from AST"
        ]
      },
      {
        "rpc": "ensure_parent_account",
        "schema": "learning",
        "file": "apps/wentrex/supabase/functions/create-parent/index.ts",
        "appId": "wentrex",
        "root": "apps/wentrex",
        "feature": null,
        "engine": null,
        "caller": null,
        "confidence": "HIGH",
        "evidence": [
          "rpc() extracted from AST"
        ]
      },
      {
        "rpc": "generate_student_login_id",
        "schema": "learning",
        "file": "apps/wentrex/supabase/functions/create-student/index.ts",
        "appId": "wentrex",
        "root": "apps/wentrex",
        "feature": null,
        "engine": null,
        "caller": null,
        "confidence": "HIGH",
        "evidence": [
          "rpc() extracted from AST"
        ]
      },
      {
        "rpc": "generate_username",
        "schema": null,
        "file": "apps/VCSM/src/features/auth/onboarding/dal/onboarding.read.dal.js",
        "appId": "VCSM",
        "root": "apps/VCSM",
        "feature": "auth",
        "engine": null,
        "caller": "generateUsernameDAL",
        "confidence": "HIGH",
        "evidence": [
          "rpc() extracted from AST"
        ]
      },
      {
        "rpc": "generate_username",
        "schema": null,
        "file": "apps/VCSM/src/scripts/load/simulateAuthenticatedActors.mjs",
        "appId": "VCSM",
        "root": "apps/VCSM",
        "feature": null,
        "engine": null,
        "caller": "ensureProfile",
        "confidence": "HIGH",
        "evidence": [
          "rpc() extracted from AST"
        ]
      },
      {
        "rpc": "get_actor_social_public_policy",
        "schema": "vc",
        "file": "apps/VCSM/src/features/social/privacy/dal/actorSocialPublicPolicy.dal.js",
        "appId": "VCSM",
        "root": "apps/VCSM",
        "feature": "social",
        "engine": null,
        "caller": "dalGetActorSocialPublicPolicy",
        "confidence": "HIGH",
        "evidence": [
          "rpc() extracted from AST"
        ]
      },
      {
        "rpc": "get_actor_summaries",
        "schema": "vc",
        "file": "engines/hydration/src/dal.js",
        "appId": null,
        "root": "engines/hydration",
        "feature": null,
        "engine": "hydration",
        "caller": "getActorSummariesByIdsDAL",
        "confidence": "HIGH",
        "evidence": [
          "rpc() extracted from AST"
        ]
      },
      {
        "rpc": "get_business_card_sections",
        "schema": null,
        "file": "apps/VCSM/src/features/public/vportBusinessCard/dal/businessCardSections.read.dal.js",
        "appId": "VCSM",
        "root": "apps/VCSM",
        "feature": "public",
        "engine": null,
        "caller": "readBusinessCardSectionsDAL",
        "confidence": "HIGH",
        "evidence": [
          "rpc() extracted from AST"
        ]
      },
      {
        "rpc": "get_follower_count",
        "schema": "vc",
        "file": "apps/VCSM/src/features/social/friend/subscribe/dal/subscriberCount.dal.js",
        "appId": "VCSM",
        "root": "apps/VCSM",
        "feature": "social",
        "engine": null,
        "caller": "dalCountSubscribers",